{
  "id": "metacore_delta_public_suite",
  "version": "0.4.0",
  "hash_contract": "METACORE_DELTA_SUITE_V1",
  "metric_registry_sha256": "sha256:b33bc39b67808a42c812228bcb2b98388f0661ca67e0550df27e204d79a369b2",
  "capsule_schema_sha256": "sha256:f2f400c2a47fce203ad170b600e04968bd18c746155e6f36f7db59bbd344d937",
  "capsules": [
    {
      "id": "AUTHORITY-001",
      "path": "authority/AUTHORITY_001.json",
      "sha256": "sha256:efcf0d2cfa883702766eac4149f61279a57cedff08dca2d53392f65f71011d98"
    },
    {
      "id": "CONTEXT-001",
      "path": "context/CONTEXT_STRESS_001.json",
      "sha256": "sha256:2963ee8385ac0ea74e55448e351272340db98c77a816cbd69d439a6750e6e969"
    },
    {
      "id": "HUMAN-CONTEXT-001",
      "path": "human_context/HUMAN_CONTEXT_001.json",
      "sha256": "sha256:c144440e9ab864b19b11ea09b6f3a740f89d774ced6c763e28b9fa64fbe30501"
    },
    {
      "id": "INJECTION-001",
      "path": "injection/INJECTION_001.json",
      "sha256": "sha256:fe88947dcf009b9287c60f0c0dc56eb3228e35de7db33d01aaa1012b8aba9117"
    },
    {
      "id": "METAPHYSICS-GROUNDING-001",
      "path": "metaphysics_grounding/METAPHYSICS_GROUNDING_001.json",
      "sha256": "sha256:a56afcf61e57c0a0fad15475c389cae2895772b1f5eddab3e2ffab1de74ce0b9"
    },
    {
      "id": "QUICK-DELTA-001",
      "path": "quick_delta/QUICK_DELTA_001.json",
      "sha256": "sha256:2be574a6ce4cf44c62533aeed2e1ec6a40f27e0222a43a746afd8a1bbc2dcf81"
    },
    {
      "id": "RECOVERY-001",
      "path": "recovery/RECOVERY_001.json",
      "sha256": "sha256:169f51cc8f0b11fbfe7ef11c74e52b3ca368b93ec82f18d1e9b604758b9a42a8"
    },
    {
      "id": "SPATIAL-QA-001",
      "path": "spatial/SPATIAL_QA_001.json",
      "sha256": "sha256:b3f839c73ad59575c26da2cdd4bafc083d44a32eaa4f5f6aa642555cea367a29"
    },
    {
      "id": "UNCERTAINTY-001",
      "path": "uncertainty/UNCERTAINTY_001.json",
      "sha256": "sha256:07aa8190810a01bed1656e8a490b9186a0a9afa52745c694a0a0ff04c0ce655d"
    }
  ],
  "suite_sha256": "sha256:d523a6a5b5321e1b1df7638612191d9d62661339ce125fa92c04b1fd657f3900"
}
